{
  "logical_store_id": {
    "genesis_fingerprint": "7b9565665e24d18788f1a681d7cea3e2a07da23bea8f9861911f0e84023a9447",
    "store_uuid": "01913f1d-8e2a-7c30-8f4a-426614174010"
  },
  "required_capabilities": [
    "wayjournal.sync/git-union-cas-v1"
  ],
  "required_projections": [
    "wayjournal.projection/revision-vector-v1"
  ],
  "schema": "wayjournal.capability-offer/v1",
  "supported_capabilities": [
    "wayjournal.admission-checkpoint/v1",
    "wayjournal.batch/v1",
    "wayjournal.catalog/v1",
    "wayjournal.identity/v1",
    "wayjournal.json/v1",
    "wayjournal.layout/v1",
    "wayjournal.profile/v1",
    "wayjournal.projection-cache/v1",
    "wayjournal.proof-vector/v1",
    "wayjournal.record/v1",
    "wayjournal.revision-vector/v1",
    "wayjournal.store/blake3-framed-v1",
    "wayjournal.sync/git-union-cas-v1",
    "wayjournal.verified-proof/v1",
    "waytask.layout/v1",
    "waytask.store/blake3-framed-v1"
  ],
  "supported_projections": [
    "wayjournal.projection/proof-vector-v1",
    "wayjournal.projection/revision-vector-v1",
    "wayjournal.projection/verified-proof-v1"
  ]
}
